{
  "schema_version": 1,
  "task": "cityroad-v29-city-park-hapi-topology-20260816",
  "module": "CityRoad",
  "asset_path": "/obj/CityRoad_DEV",
  "allowed_files": [
    "Assets/PCG/HDA/City/CityRoad.hda",
    "HoudiniProject/PCG_Track_21.0.440/PCG_Bike_CityRoad.hip",
    "HoudiniProject/PCG_Track_21.0.440/scripts/tools/patch_cityroad_city_park_v29_hapi_topology.py",
    "HoudiniProject/PCG_Track_21.0.440/scripts/tools/validate_cityroad_contract.py",
    "HoudiniProject/PCG_Track_21.0.440/scripts/contracts/cityroad_contract.json",
    "HoudiniProject/PCG_Track_21.0.440/scripts/contracts/cityroad_subnet_layout_contract.json",
    "HoudiniProject/PCG_Track_21.0.440/scripts/contracts/changes/cityroad_v29_city_park_hapi_topology_20260816.json"
  ],
  "allowed_nodes": [
    "CityRoadCore/CR_CITY_PARK/PARK_ENABLE_INPUT_SWITCH",
    "CityRoadCore/CR_CITY_PARK/PARK_REBUILD_HAPI_TOPOLOGY_V29",
    "CityRoadCore/CR_CITY_PARK/PARK_LAYOUT_AND_SCATTER_V20"
  ],
  "allowed_added_nodes": [
    "CityRoadCore/CR_CITY_PARK/PARK_REBUILD_HAPI_TOPOLOGY_V29"
  ],
  "allowed_removed_nodes": [],
  "allowed_connections": [
    "CityRoadCore/CR_CITY_PARK/PARK_REBUILD_HAPI_TOPOLOGY_V29",
    "CityRoadCore/CR_CITY_PARK/PARK_LAYOUT_AND_SCATTER_V20"
  ],
  "allowed_parameters": [
    "CityRoadCore/CR_CITY_PARK/PARK_ENABLE_INPUT_SWITCH:input",
    "CityRoadCore/CR_CITY_PARK/PARK_REBUILD_HAPI_TOPOLOGY_V29:*"
  ],
  "allowed_public_parameters": [],
  "allow_output_changes": true,
  "allowed_warning_signatures": [],
  "required_contracts": [
    "CityRoad.Interface.Public",
    "CityRoad.Network.Outputs",
    "CityRoad.V20.CityPark",
    "CityRoad.V24.PostCommitMarkingValidation"
  ]
}
