{
  "schema_version": 1,
  "task": "cityroad-street-furniture-road-containment-20260812",
  "module": "CityRoad",
  "asset_path": "/obj/CityRoad_DEV",
  "allowed_files": [
    "Assets/PCG/HDA/City/CityRoad.hda",
    "HoudiniProject/PCG_Track_21.0.440/PCG_Bike_CityRoad.hip",
    "HoudiniProject/PCG_Track_21.0.440/scripts/tools/patch_cityroad_street_furniture_road_containment_20260812.py",
    "HoudiniProject/PCG_Track_21.0.440/scripts/tools/validate_cityroad_contract.py",
    "HoudiniProject/PCG_Track_21.0.440/scripts/contracts/cityroad_contract.json",
    "HoudiniProject/PCG_Track_21.0.440/scripts/contracts/changes/cityroad_street_furniture_road_containment_20260812.json",
    "Assets/PCG/Generated/Road/CityRoad/**"
  ],
  "allowed_nodes": [
    "CityRoadCore/CITYROAD_STREET_BUILD_LAMPS_V1",
    "CityRoadCore/CITYROAD_STREET_BUILD_TREES_V1"
  ],
  "allowed_added_nodes": [],
  "allowed_removed_nodes": [],
  "allowed_connections": [
    "CityRoadCore/CITYROAD_STREET_BUILD_LAMPS_V1",
    "CityRoadCore/CITYROAD_STREET_BUILD_TREES_V1"
  ],
  "allowed_parameters": [
    "CityRoadCore/CITYROAD_STREET_BUILD_LAMPS_V1:snippet",
    "CityRoadCore/CITYROAD_STREET_BUILD_TREES_V1:snippet"
  ],
  "allowed_public_parameters": [],
  "allow_output_changes": true,
  "allowed_warning_signatures": [],
  "required_contracts": [
    "CityRoad.Interface.Public",
    "CityRoad.Network.Outputs",
    "CityRoad.Phase13.ShadingAndChunks",
    "CityRoad.Phase14.TopologyOutputs",
    "CityRoad.Phase15.SingleInput",
    "CityRoad.Phase16.AdaptiveCorner",
    "CityRoad.Phase17.FinalBoundary",
    "CityRoad.V7.JunctionExtent",
    "CityRoad.V7.MarkingClip",
    "CityRoad.V8.MobileCornerRails",
    "CityRoad.V8.EdgeLineContinuity",
    "CityRoad.V9.FinalBoundaryBudget",
    "CityRoad.V10.CornerSections",
    "CityRoad.V10.SidewalkSections",
    "CityRoad.V11.DeterministicSidewalkCornerStrips",
    "CityRoad.V12.FinalBoundaryCornerSections",
    "CityRoad.V13.SquareOpenEnds",
    "CityRoad.V14.NonTerminalRounding",
    "CityRoad.V15.SidewalkTerminalFrontContainment",
    "CityRoad.V16.StreetFurniture",
    "CityRoad.Output.NoCookDiagnostics",
    "CityRoad.Output.GeometrySanity",
    "CityRoad.Output.Winding"
  ]
}
