{
  "schema_version": 1,
  "task": "cityroad-street-furniture-20260812",
  "module": "CityRoad",
  "asset_path": "/obj/CityRoad_DEV",
  "allowed_files": [
    "Assets/PCG/HDA/City/CityRoad.hda",
    "HoudiniProject/PCG_Track_21.0.440/PCG_Bike_CityRoad.hip",
    "HoudiniProject/PCG_Track_21.0.440/scripts/tools/patch_cityroad_street_furniture_20260812.py",
    "HoudiniProject/PCG_Track_21.0.440/scripts/tools/validate_cityroad_contract.py",
    "HoudiniProject/PCG_Track_21.0.440/scripts/tools/pcg_regression_gate.py",
    "HoudiniProject/PCG_Track_21.0.440/scripts/contracts/cityroad_contract.json",
    "HoudiniProject/PCG_Track_21.0.440/scripts/contracts/changes/cityroad_street_furniture_20260812.json",
    "Assets/PCG/Editor/CityRoad/CityRoadBakeWorkflow.cs",
    "Assets/PCG/Editor/CityRoad/CityRoadLivePreviewController.cs",
    "Assets/PCG/Editor/CityRoad/CityRoadStreetFurniturePlaceholders.cs",
    "Assets/PCG/Scripts/Tests/Editor/CityRoad/CityRoadStreetFurnitureTests.cs",
    "Assets/PCG/Art/StreetFurniture/**",
    "Assets/PCG/Generated/Road/CityRoad/**"
  ],
  "allowed_nodes": [
    "CityRoadCore/CITYROAD_STREET_*",
    "CityRoadCore/OUT_STREET_LAMPS",
    "CityRoadCore/OUT_STREET_TREES",
    "CityRoadCore/OUT_STREET_TREE_PITS"
  ],
  "allowed_added_nodes": [
    "CityRoadCore/CITYROAD_STREET_*",
    "CityRoadCore/OUT_STREET_LAMPS",
    "CityRoadCore/OUT_STREET_TREES",
    "CityRoadCore/OUT_STREET_TREE_PITS"
  ],
  "allowed_removed_nodes": [],
  "allowed_connections": [
    "CityRoadCore/CITYROAD_STREET_*",
    "CityRoadCore/OUT_STREET_LAMPS",
    "CityRoadCore/OUT_STREET_TREES",
    "CityRoadCore/OUT_STREET_TREE_PITS"
  ],
  "allowed_parameters": [
    ".:tree_prefab2",
    ".:tree_prefab3",
    "CityRoadCore/CITYROAD_STREET_*:*",
    "CityRoadCore/OUT_STREET_LAMPS:*",
    "CityRoadCore/OUT_STREET_TREES:*",
    "CityRoadCore/OUT_STREET_TREE_PITS:*"
  ],
  "allowed_public_parameters": [
    "street_furniture_folder",
    "street_furniture_folder/**",
    "Street Furniture/**",
    "enable_street_lamps",
    "lamp_prefab",
    "lamp_spacing",
    "lamp_yaw_offset",
    "enable_street_trees",
    "tree_variants*",
    "tree_prefab*",
    "tree_weight*",
    "tree_spacing_min",
    "tree_spacing_max",
    "tree_scale_min",
    "tree_scale_max",
    "tree_seed",
    "tree_pit_prefab",
    "tree_pit_probability",
    "facility_edge_inset",
    "minimum_sidewalk_width",
    "lamp_tree_clearance",
    "junction_endpoint_clearance"
  ],
  "allow_output_changes": true,
  "allowed_warning_signatures": [],
  "required_contracts": [
    "CityRoad.Interface.Public",
    "CityRoad.Network.Outputs",
    "CityRoad.Phase13.ShadingAndChunks",
    "CityRoad.Phase14.TopologyOutputs",
    "CityRoad.Phase15.SingleInput",
    "CityRoad.Phase16.AdaptiveCorner",
    "CityRoad.Phase17.FinalBoundary",
    "CityRoad.V7.JunctionExtent",
    "CityRoad.V7.MarkingClip",
    "CityRoad.V8.MobileCornerRails",
    "CityRoad.V8.EdgeLineContinuity",
    "CityRoad.V9.FinalBoundaryBudget",
    "CityRoad.V10.CornerSections",
    "CityRoad.V10.SidewalkSections",
    "CityRoad.V11.DeterministicSidewalkCornerStrips",
    "CityRoad.V12.FinalBoundaryCornerSections",
    "CityRoad.V13.SquareOpenEnds",
    "CityRoad.V14.NonTerminalRounding",
    "CityRoad.V15.SidewalkTerminalFrontContainment",
    "CityRoad.Output.NoCookDiagnostics",
    "CityRoad.Output.GeometrySanity",
    "CityRoad.Output.Winding"
  ]
}
