{
  "schema_version": 1,
  "task": "cityroad-v20-city-park-20260813",
  "module": "CityRoad",
  "asset_path": "/obj/CityRoad_DEV",
  "allowed_files": [
    "Assets/PCG/HDA/City/CityRoad.hda",
    "HoudiniProject/PCG_Track_21.0.440/PCG_Bike_CityRoad.hip",
    "HoudiniProject/PCG_Track_21.0.440/scripts/tools/patch_cityroad_city_park_v20_20260813.py",
    "HoudiniProject/PCG_Track_21.0.440/scripts/tools/validate_cityroad_contract.py",
    "HoudiniProject/PCG_Track_21.0.440/scripts/contracts/cityroad_contract.json",
    "HoudiniProject/PCG_Track_21.0.440/scripts/contracts/changes/cityroad_v20_city_park_20260813.json",
    "Assets/PCG/Editor/CityRoad/CityRoadSafeRebuild.cs",
    "Assets/PCG/Editor/CityRoad/CityRoadBakeWorkflow.cs",
    "Assets/PCG/Editor/CityRoad/CityRoadLivePreviewController.cs",
    "Assets/PCG/Editor/CityRoad/CityRoadParkAssets.cs",
    "Assets/PCG/Editor/CityRoad/CityRoadParkAssets.cs.meta",
    "Assets/PCG/Scripts/CityPark.meta",
    "Assets/PCG/Scripts/CityPark/**",
    "Assets/PCG/Scripts/Tests/Editor/CityRoad/CityRoadParkTests.cs",
    "Assets/PCG/Scripts/Tests/Editor/CityRoad/CityRoadParkTests.cs.meta",
    "Assets/PCG/Shaders/PCG_CityPark_VegetationIndirect.shader",
    "Assets/PCG/Shaders/PCG_CityPark_VegetationIndirect.shader.meta",
    "Assets/PCG/Shaders/PCG_CityPark_Culling.compute",
    "Assets/PCG/Shaders/PCG_CityPark_Culling.compute.meta",
    "Assets/PCG/Materials/CityPark.meta",
    "Assets/PCG/Materials/CityPark/**",
    "Assets/PCG/Settings/CityPark.meta",
    "Assets/PCG/Settings/CityPark/**",
    "Assets/Settings/URP-Performant-Renderer.asset",
    "Assets/Settings/URP-Balanced-Renderer.asset",
    "Assets/Settings/URP-HighFidelity-Renderer.asset",
    "Assets/PCG/Generated/Road/CityRoad/**"
  ],
  "allowed_nodes": [
    "CityRoadCore/CR_CITY_PARK",
    "CityRoadCore/CR_CITY_PARK/*",
    "CityRoadCore/OUT_PARK_*"
  ],
  "allowed_added_nodes": [
    "CityRoadCore/CR_CITY_PARK",
    "CityRoadCore/CR_CITY_PARK/*",
    "CityRoadCore/OUT_PARK_*"
  ],
  "allowed_removed_nodes": [],
  "allowed_connections": [
    "CityRoadCore/CR_CITY_PARK",
    "CityRoadCore/CR_CITY_PARK/*",
    "CityRoadCore/OUT_PARK_*"
  ],
  "allowed_parameters": [
    ".:enable_city_park",
    ".:unity_park_areas",
    ".:park_*",
    "CityRoadCore/CR_CITY_PARK:*",
    "CityRoadCore/CR_CITY_PARK/*:*",
    "CityRoadCore/OUT_PARK_*:*"
  ],
  "allowed_public_parameters": [
    "city_park_folder*",
    "City Park/**",
    "enable_city_park",
    "unity_park_areas",
    "park_*"
  ],
  "allow_output_changes": true,
  "allowed_warning_signatures": [],
  "required_contracts": [
    "CityRoad.Interface.Public",
    "CityRoad.Network.Outputs",
    "CityRoad.Phase13.ShadingAndChunks",
    "CityRoad.Phase14.TopologyOutputs",
    "CityRoad.Phase15.SingleInput",
    "CityRoad.Phase16.AdaptiveCorner",
    "CityRoad.Phase17.FinalBoundary",
    "CityRoad.V7.JunctionExtent",
    "CityRoad.V7.MarkingClip",
    "CityRoad.V8.MobileCornerRails",
    "CityRoad.V8.EdgeLineContinuity",
    "CityRoad.V9.FinalBoundaryBudget",
    "CityRoad.V10.CornerSections",
    "CityRoad.V10.SidewalkSections",
    "CityRoad.V11.DeterministicSidewalkCornerStrips",
    "CityRoad.V12.FinalBoundaryCornerSections",
    "CityRoad.V13.SquareOpenEnds",
    "CityRoad.V14.NonTerminalRounding",
    "CityRoad.V15.SidewalkTerminalFrontContainment",
    "CityRoad.Output.NoCookDiagnostics",
    "CityRoad.Output.GeometrySanity",
    "CityRoad.Output.Winding",
    "CityRoad.V16.StreetFurniture",
    "CityRoad.V17.StreetFurnitureSurfaceContainment",
    "CityRoad.V18.CookOptimization",
    "CityRoad.V19.SubnetLayout"
  ]
}
