{
  "schema_version": 1,
  "task": "cityroad-v14-nonterminal-rounding",
  "module": "CityRoad",
  "asset_path": "/obj/CityRoad_DEV",
  "allowed_files": [
    "Assets/PCG/HDA/City/CityRoad.hda",
    "HoudiniProject/PCG_Track_21.0.440/PCG_Bike_CityRoad.hip",
    "HoudiniProject/PCG_Track_21.0.440/scripts/tools/patch_cityroad_nonterminal_rounding_v14.py",
    "HoudiniProject/PCG_Track_21.0.440/scripts/tools/validate_cityroad_contract.py",
    "HoudiniProject/PCG_Track_21.0.440/scripts/contracts/cityroad_contract.json"
  ],
  "allowed_nodes": [
    "CityRoadCore/ROAD_UNION_ROUND_FINAL_BOUNDARY"
  ],
  "allowed_added_nodes": [],
  "allowed_removed_nodes": [],
  "allowed_connections": [],
  "allowed_parameters": [],
  "allowed_public_parameters": [],
  "allow_output_changes": true,
  "allowed_warning_signatures": [],
  "required_contracts": [
    "CityRoad.V7.JunctionExtent",
    "CityRoad.V8.MobileCornerRails",
    "CityRoad.V9.FinalBoundaryBudget",
    "CityRoad.V10.CornerSections",
    "CityRoad.V10.SidewalkSections",
    "CityRoad.V11.DeterministicSidewalkCornerStrips",
    "CityRoad.V12.FinalBoundaryCornerSections",
    "CityRoad.V13.SquareOpenEnds",
    "CityRoad.V14.NonTerminalRounding",
    "CityRoad.Output.NoCookDiagnostics",
    "CityRoad.Output.GeometrySanity",
    "CityRoad.Output.Winding"
  ]
}
