{
  "schema_version": 1,
  "task": "cityroad-v31-city-park-hapi-duplicate-endpoint-20260816",
  "module": "CityRoad",
  "asset_path": "/obj/CityRoad_DEV",
  "allowed_files": [
    "Assets/PCG/HDA/City/CityRoad.hda",
    "HoudiniProject/PCG_Track_21.0.440/PCG_Bike_CityRoad.hip",
    "HoudiniProject/PCG_Track_21.0.440/scripts/tools/patch_cityroad_city_park_v31_hapi_duplicate_endpoint.py",
    "HoudiniProject/PCG_Track_21.0.440/scripts/contracts/changes/cityroad_v31_city_park_hapi_duplicate_endpoint_20260816.json"
  ],
  "allowed_nodes": [
    "CityRoadCore/CR_CITY_PARK/PARK_REBUILD_HAPI_TOPOLOGY_V29"
  ],
  "allowed_added_nodes": [],
  "allowed_removed_nodes": [],
  "allowed_connections": [],
  "allowed_parameters": [
    "CityRoadCore/CR_CITY_PARK/PARK_REBUILD_HAPI_TOPOLOGY_V29:snippet"
  ],
  "allowed_public_parameters": [],
  "allow_output_changes": true,
  "allowed_warning_signatures": [],
  "required_contracts": [
    "CityRoad.Interface.Public",
    "CityRoad.Network.Outputs",
    "CityRoad.V20.CityPark",
    "CityRoad.V24.PostCommitMarkingValidation"
  ]
}
