{
  "schema_version": 1,
  "task": "cityroad-subnet-layout-20260813",
  "module": "CityRoad",
  "asset_path": "/obj/CityRoad_DEV",
  "allowed_files": [
    "Assets/PCG/HDA/City/CityRoad.hda",
    "HoudiniProject/PCG_Track_21.0.440/PCG_Bike_CityRoad.hip",
    "HoudiniProject/PCG_Track_21.0.440/scripts/contracts/cityroad_contract.json",
    "HoudiniProject/PCG_Track_21.0.440/scripts/contracts/cityroad_subnet_layout_contract.json",
    "HoudiniProject/PCG_Track_21.0.440/scripts/contracts/changes/cityroad_subnet_layout_20260813.json",
    "HoudiniProject/PCG_Track_21.0.440/scripts/tools/patch_cityroad_subnet_layout_20260813.py",
    "HoudiniProject/PCG_Track_21.0.440/scripts/tools/capture_cityroad_layout_signatures.py",
    "HoudiniProject/PCG_Track_21.0.440/scripts/tools/benchmark_cityroad_cook.py",
    "HoudiniProject/PCG_Track_21.0.440/scripts/tools/validate_cityroad_contract.py",
    "HoudiniProject/PCG_Track_21.0.440/scripts/tools/pcg_regression_gate.py"
  ],
  "allowed_nodes": [
    "CityRoadCore",
    "CityRoadCore/*",
    "CityRoadCore/CR_*/*"
  ],
  "allowed_added_nodes": [
    "CityRoadCore/CR_*",
    "CityRoadCore/CR_*/*"
  ],
  "allowed_removed_nodes": [
    "CityRoadCore/*"
  ],
  "allowed_connections": [
    "CityRoadCore/*",
    "CityRoadCore/CR_*/*"
  ],
  "allowed_parameters": [
    "CityRoadCore:*",
    "CityRoadCore/CR_*:*",
    "CityRoadCore/CR_*/*:*"
  ],
  "allowed_public_parameters": [],
  "allow_output_changes": false,
  "allowed_warning_signatures": [],
  "required_contracts": [
    "CityRoad.Interface.Public",
    "CityRoad.Network.Outputs",
    "CityRoad.Phase13.ShadingAndChunks",
    "CityRoad.Phase14.TopologyOutputs",
    "CityRoad.Phase15.SingleInput",
    "CityRoad.Phase16.AdaptiveCorner",
    "CityRoad.Phase17.FinalBoundary",
    "CityRoad.V7.JunctionExtent",
    "CityRoad.V7.MarkingClip",
    "CityRoad.V8.MobileCornerRails",
    "CityRoad.V8.EdgeLineContinuity",
    "CityRoad.V9.FinalBoundaryBudget",
    "CityRoad.V10.CornerSections",
    "CityRoad.V10.SidewalkSections",
    "CityRoad.V11.DeterministicSidewalkCornerStrips",
    "CityRoad.V12.FinalBoundaryCornerSections",
    "CityRoad.V13.SquareOpenEnds",
    "CityRoad.V14.NonTerminalRounding",
    "CityRoad.V15.SidewalkTerminalFrontContainment",
    "CityRoad.Output.NoCookDiagnostics",
    "CityRoad.Output.GeometrySanity",
    "CityRoad.Output.Winding",
    "CityRoad.V16.StreetFurniture",
    "CityRoad.V17.StreetFurnitureSurfaceContainment",
    "CityRoad.V18.CookOptimization",
    "CityRoad.V19.SubnetLayout"
  ]
}
