{
  "schema_version": 1,
  "task": "cityroad-core-layout-cleanup-20260812",
  "module": "CityRoad",
  "asset_path": "/obj/CityRoad_DEV",
  "allowed_files": [
    "Assets/PCG/HDA/City/CityRoad.hda",
    "HoudiniProject/PCG_Track_21.0.440/PCG_Bike_CityRoad.hip",
    "HoudiniProject/PCG_Track_21.0.440/scripts/tools/layout_cityroad_core_20260812.py",
    "HoudiniProject/PCG_Track_21.0.440/scripts/contracts/changes/cityroad_core_layout_cleanup_20260812.json"
  ],
  "allowed_nodes": [],
  "allowed_added_nodes": [],
  "allowed_removed_nodes": [],
  "allowed_connections": [],
  "allowed_parameters": [],
  "allowed_public_parameters": [],
  "allow_output_changes": false,
  "allowed_warning_signatures": [],
  "required_contracts": [
    "CityRoad.Interface.Public",
    "CityRoad.Network.Outputs",
    "CityRoad.Phase13.ShadingAndChunks",
    "CityRoad.Phase14.TopologyOutputs",
    "CityRoad.Phase15.SingleInput",
    "CityRoad.Phase16.AdaptiveCorner",
    "CityRoad.Phase17.FinalBoundary",
    "CityRoad.V7.JunctionExtent",
    "CityRoad.V7.MarkingClip",
    "CityRoad.V8.MobileCornerRails",
    "CityRoad.V8.EdgeLineContinuity",
    "CityRoad.V9.FinalBoundaryBudget",
    "CityRoad.V10.CornerSections",
    "CityRoad.V10.SidewalkSections",
    "CityRoad.V11.DeterministicSidewalkCornerStrips",
    "CityRoad.V12.FinalBoundaryCornerSections",
    "CityRoad.V13.SquareOpenEnds",
    "CityRoad.V14.NonTerminalRounding",
    "CityRoad.V15.SidewalkTerminalFrontContainment",
    "CityRoad.Output.NoCookDiagnostics",
    "CityRoad.Output.GeometrySanity",
    "CityRoad.Output.Winding"
  ]
}
