{
  "schema_version": 1,
  "task": "cityroad-building-layout-20261023",
  "module": "CityRoad",
  "asset_path": "/obj/CityRoad_DEV",
  "allowed_files": [
    "Assets/PCG/HDA/City/CityRoad.hda",
    "HoudiniProject/PCG_Track_21.0.440/PCG_Bike_CityRoad.hip",
    "HoudiniProject/PCG_Track_21.0.440/scripts/tools/cityroad_frontage.vfl",
    "HoudiniProject/PCG_Track_21.0.440/scripts/tools/validate_cityroad_frontage.py",
    "HoudiniProject/PCG_Track_21.0.440/scripts/tools/validate_cityroad_contract.py",
    "HoudiniProject/PCG_Track_21.0.440/scripts/contracts/cityroad_contract.json",
    "HoudiniProject/PCG_Track_21.0.440/scripts/contracts/changes/cityroad_building_layout_20261023.json",
    "HoudiniProject/PCG_Track_21.0.440/scripts/tools/patch_cityroad_building_layout_20261023.py"
  ],
  "allowed_nodes": [
    "CityRoadCore/CR_BUILDINGS/BUILD_FRONTAGE"
  ],
  "allowed_added_nodes": [],
  "allowed_removed_nodes": [],
  "allowed_connections": [],
  "allowed_parameters": [
    "CityRoadCore/CR_BUILDINGS/BUILD_FRONTAGE:*"
  ],
  "allowed_public_parameters": [
    "street_buildings_folder/building_layout_enabled",
    "street_buildings_folder/building_setback_max",
    "street_buildings_folder/building_gap_max",
    "street_buildings_folder/building_empty_ratio",
    "street_buildings_folder/building_group_length",
    "street_buildings_folder/building_within_group_jitter",
    "street_buildings_folder/building_layout_seed_offset"
  ],
  "allow_output_changes": true,
  "allowed_warning_signatures": [],
  "required_contracts": [
    "CityRoad.Interface.Public",
    "CityRoad.Network.Outputs",
    "CityRoad.Phase13.ShadingAndChunks",
    "CityRoad.Phase14.TopologyOutputs",
    "CityRoad.Phase15.SingleInput",
    "CityRoad.Phase16.AdaptiveCorner",
    "CityRoad.Phase17.FinalBoundary",
    "CityRoad.V7.JunctionExtent",
    "CityRoad.V7.MarkingClip",
    "CityRoad.V8.MobileCornerRails",
    "CityRoad.V8.EdgeLineContinuity",
    "CityRoad.V9.FinalBoundaryBudget",
    "CityRoad.V10.CornerSections",
    "CityRoad.V10.SidewalkSections",
    "CityRoad.V11.DeterministicSidewalkCornerStrips",
    "CityRoad.V12.FinalBoundaryCornerSections",
    "CityRoad.V13.SquareOpenEnds",
    "CityRoad.V14.NonTerminalRounding",
    "CityRoad.V15.SidewalkTerminalFrontContainment",
    "CityRoad.Output.NoCookDiagnostics",
    "CityRoad.Output.GeometrySanity",
    "CityRoad.Output.Winding",
    "CityRoad.V16.StreetFurniture",
    "CityRoad.V17.StreetFurnitureSurfaceContainment",
    "CityRoad.V18.CookOptimization",
    "CityRoad.V19.SubnetLayout",
    "CityRoad.V22.ZeroCornerTolerance",
    "CityRoad.V24.PostCommitMarkingValidation",
    "CityRoad.V38.CoreReadability",
    "CityRoad.V46.ThreeLevelReadability",
    "CityRoad.V47.AnnotationClarity",
    "CityRoad.V48.DeadNodeCleanup",
    "CityRoad.V49.RemoveDeadCollisionAndShellBranches",
    "CityRoad.V50.CityParkDecoupled",
    "CityRoad.V51.RestoreGeneration",
    "CityRoad.V52.StreetBuildingPlacement",
    "CityRoad.V53.BuildingControls",
    "CityRoad.V54.DirectPrefabAssignment"
  ]
}
