{
  "schema_version": 1,
  "task": "cityroad-v21-public-cleanup-scene-20260813",
  "module": "CityRoad",
  "asset_path": "/obj/CityRoad_DEV",
  "allowed_files": [
    "Assets/PCG/HDA/City/CityRoad.hda",
    "HoudiniProject/PCG_Track_21.0.440/PCG_Bike_CityRoad.hip",
    "HoudiniProject/PCG_Track_21.0.440/scripts/tools/patch_cityroad_public_cleanup_v21_20260813.py",
    "HoudiniProject/PCG_Track_21.0.440/scripts/tools/validate_cityroad_contract.py",
    "HoudiniProject/PCG_Track_21.0.440/scripts/contracts/cityroad_contract.json",
    "HoudiniProject/PCG_Track_21.0.440/scripts/contracts/changes/cityroad_v21_public_cleanup_scene_20260813.json",
    "Assets/PCG/Editor/CityRoad/CityRoadSafeRebuild.cs",
    "Assets/PCG/Scenes/PCG_City.unity",
    "Assets/PCG/Generated/Road/CityRoad/**",
    "Assets/PCG/Scripts/Tests/Editor/CityRoad/CityRoadParkTests.cs"
  ],
  "allowed_nodes": [],
  "allowed_added_nodes": [],
  "allowed_removed_nodes": [],
  "allowed_connections": [],
  "allowed_parameters": [],
  "allowed_public_parameters": [
    "stdswitcher9_*",
    "label1",
    "label2",
    "label3",
    "label4",
    "tdisplay",
    "display",
    "outputobj",
    "visibleobjects",
    "picking",
    "pickscript",
    "caching",
    "use_dcolor",
    "dcolor"
  ],
  "allow_output_changes": false,
  "allowed_warning_signatures": [],
  "required_contracts": [
    "CityRoad.Interface.Public",
    "CityRoad.Network.Outputs",
    "CityRoad.Phase13.ShadingAndChunks",
    "CityRoad.Phase14.TopologyOutputs",
    "CityRoad.Phase15.SingleInput",
    "CityRoad.Phase16.AdaptiveCorner",
    "CityRoad.Phase17.FinalBoundary",
    "CityRoad.V7.JunctionExtent",
    "CityRoad.V7.MarkingClip",
    "CityRoad.V8.MobileCornerRails",
    "CityRoad.V8.EdgeLineContinuity",
    "CityRoad.V9.FinalBoundaryBudget",
    "CityRoad.V10.CornerSections",
    "CityRoad.V10.SidewalkSections",
    "CityRoad.V11.DeterministicSidewalkCornerStrips",
    "CityRoad.V12.FinalBoundaryCornerSections",
    "CityRoad.V13.SquareOpenEnds",
    "CityRoad.V14.NonTerminalRounding",
    "CityRoad.V15.SidewalkTerminalFrontContainment",
    "CityRoad.Output.NoCookDiagnostics",
    "CityRoad.Output.GeometrySanity",
    "CityRoad.Output.Winding",
    "CityRoad.V16.StreetFurniture",
    "CityRoad.V17.StreetFurnitureSurfaceContainment",
    "CityRoad.V18.CookOptimization",
    "CityRoad.V19.SubnetLayout",
    "CityRoad.V20.CityPark"
  ]
}
