{
  "schema_version": 1,
  "task": "cityroad-v35-baked-state-callback-guard-20260816",
  "module": "CityRoad",
  "asset_path": "/obj/CityRoad_DEV",
  "allowed_files": [
    "Assets/PCG/HDA/City/CityRoad.hda",
    "HoudiniProject/PCG_Track_21.0.440/PCG_Bike_CityRoad.hip",
    "HoudiniProject/PCG_Track_21.0.440/scripts/contracts/changes/cityroad_v35_baked_state_callback_guard_20260816.json",
    "Assets/PCG/Editor/CityRoad/CityRoadLivePreviewController.cs",
    "Assets/PCG/Scripts/Tests/Editor/CityRoad/CityRoadParkTests.cs",
    "Assets/PCG/Scenes/PCG_City.unity"
  ],
  "allowed_nodes": [],
  "allowed_added_nodes": [],
  "allowed_removed_nodes": [],
  "allowed_connections": [],
  "allowed_parameters": [],
  "allowed_public_parameters": [],
  "allow_output_changes": false,
  "allowed_warning_signatures": [],
  "required_contracts": [
    "CityRoad.Interface.Public",
    "CityRoad.Network.Outputs",
    "CityRoad.V20.CityPark",
    "CityRoad.V24.PostCommitMarkingValidation"
  ]
}
