{
  "schema_version": 1,
  "task": "cityroad-v13-square-open-ends",
  "module": "CityRoad",
  "asset_path": "/obj/CityRoad_DEV",
  "allowed_files": [
    "Assets/PCG/HDA/City/CityRoad.hda",
    "HoudiniProject/PCG_Track_21.0.440/PCG_Bike_CityRoad.hip",
    "HoudiniProject/PCG_Track_21.0.440/scripts/tools/patch_cityroad_square_open_ends_v13.py",
    "HoudiniProject/PCG_Track_21.0.440/scripts/tools/validate_cityroad_contract.py",
    "HoudiniProject/PCG_Track_21.0.440/scripts/contracts/cityroad_contract.json"
  ],
  "allowed_nodes": [
    "CityRoadCore/ROAD_UNION_ROUND_FINAL_BOUNDARY",
    "CityRoadCore/SIDEWALK_OPEN_END_SIDE_CONNECTORS",
    "CityRoadCore/SIDEWALK_OPEN_END_SEAM_SHATTER",
    "CityRoadCore/SIDEWALK_PLANAR_CONSTRAINT_FUSE",
    "CityRoadCore/SIDEWALK_PLANAR_MARK_CONSTRAINT_EDGES",
    "CityRoadCore/SIDEWALK_PLANAR_TRIANGULATE",
    "CityRoadCore/SIDEWALK_PLANAR_MARK_SEAMS",
    "CityRoadCore/SIDEWALK_TOPOLOGY_VALIDATE",
    "CityRoadCore/SIDEWALK_REGION_METADATA"
  ],
  "allowed_added_nodes": [],
  "allowed_removed_nodes": [],
  "allowed_connections": [
    "CityRoadCore/ROAD_UNION_ROUND_FINAL_BOUNDARY",
    "CityRoadCore/SIDEWALK_OPEN_END_SEAM_SHATTER",
    "CityRoadCore/SIDEWALK_PLANAR_MARK_SEAMS",
    "CityRoadCore/CITYROAD_FUSE_SIDEWALK_TRIANGULATION_V10"
  ],
  "allowed_parameters": [
    "CityRoadCore/SIDEWALK_PLANAR_TRIANGULATE/removeoutsidesilhouette"
  ],
  "allowed_public_parameters": [],
  "allow_output_changes": true,
  "allowed_warning_signatures": [],
  "required_contracts": [
    "CityRoad.V7.JunctionExtent",
    "CityRoad.V8.MobileCornerRails",
    "CityRoad.V9.FinalBoundaryBudget",
    "CityRoad.V10.CornerSections",
    "CityRoad.V10.SidewalkSections",
    "CityRoad.V11.DeterministicSidewalkCornerStrips",
    "CityRoad.V12.FinalBoundaryCornerSections",
    "CityRoad.V13.SquareOpenEnds",
    "CityRoad.Output.NoCookDiagnostics",
    "CityRoad.Output.GeometrySanity",
    "CityRoad.Output.Winding"
  ]
}
